0,0,0,0,1,1,0,0,0,1,1,0,0,0,0,1,0,0,0,0,0,0,0,0,0,0,0,0,0,0,0,0,0,0,0,0,0,0,0,0,0,0,0,0,0,0,0,0,0,0,0,0,0,0,0,0,1,0,0,0,0,0,0,0,0,0,0,0,0,0,0,1,0,0,0,0,0,0,0,0,0,0,0,1,0,0,0,0,0,0,0,0,0,0,0,0,0,0,0,0,1,0,0,0,0,0,0,0,0,0,0,0,0,0,0,0,1,0,0,0,0,0,0,0,0,0,0,0,0,0,0,0,0,0,0,0,0,0,0,0,1,0,0,0,0,0,0,0,1,0,0,0,1,0,0,0,0,0,0,0,0,0,0,0,0,0,1,0,0,0,0,0,0,0,0,1,1,1,0,0,1,0,0,0,0,0,0,0,1,0,0,0,0,0,0,0,0,0,0,0,0,1,0,1,0,0,0,0,0,0,0,0,0,0,0,1,1,0,0,0,0,1,0,1,1,0,0,0,0,0,0,0,0,0,0,0,0,0,0,0,0,0,0,0,0,0,0,0,0,0,0,0,1,0,0,0,0,0,0,0,0,0,0,0,0,0,0,0,0,0,0,0,1,0,0,0,0,1,0,0,0,1,0,0,1,0,0,0,0,1,1,0,0,0,0,0,0,0,0,0,0,0,0,0,0,1,0,0,0,0,0,0,0,0,0,0,0,0,0,1,0,0,0,0,1,0,1,0,0,0,0,0,0,0,0,0,0,0,0,0,0,0,0,0,0,0,0,0,0,0,0,0,0,0,0,0,0,0,0,0,campos,encostei-me trás cadeira convés fechei olhos destino apareceu-me alma precipício vida passada misturou-se futura meio ruído salão fumo onde ouvidos acabara partida xadrez ah balouçado sensação ondas ah embalado idéia tão confortável hoje ainda amanhã menos neste momento responsabilidades nenhumas personalidade propriamente sentir-me ali cima cadeira livro sueca ali deixasse ah afundado torpor imaginação dúvida pouco sono irrequieto tão sossegadamente tão análogo repente criança outrora brincava quinta sabia álgebra outras álgebras x y's sentimento ah todo anseio momento importância nenhuma vida ah todo anseio momento outros análogos -- momentos importância nenhuma compreendi todo vácuo existência inteligência compreender luar mar solidão ó álvaro
0,0,0,0,0,0,0,0,0,0,0,0,0,0,0,0,0,0,0,0,0,0,0,0,0,0,0,0,0,0,0,0,0,0,0,0,0,0,0,0,0,1,0,0,0,0,0,0,0,0,0,0,0,0,0,0,0,0,0,0,0,0,0,0,0,0,0,0,0,0,0,0,0,0,0,0,0,0,0,0,0,0,0,0,0,0,0,0,0,0,0,0,0,0,0,0,0,0,0,0,0,0,0,0,0,0,0,0,0,0,0,0,0,0,0,0,0,0,0,0,0,0,0,0,0,0,0,0,0,0,0,0,0,1,0,0,0,0,0,0,0,0,0,0,0,0,0,0,0,0,0,0,0,0,0,0,0,0,0,0,0,1,0,0,0,0,0,0,0,0,0,0,0,0,0,0,0,1,0,0,0,0,0,0,0,0,0,0,0,0,0,0,1,0,0,0,0,0,0,0,0,0,0,1,0,0,0,0,0,0,0,0,0,0,0,0,0,0,0,0,0,0,0,0,0,0,0,0,0,0,1,0,0,0,0,0,0,0,0,0,0,0,0,0,0,0,0,0,0,0,0,0,0,0,0,0,0,0,0,0,0,0,0,0,0,0,0,0,0,0,0,0,0,0,0,0,0,0,0,0,0,0,0,0,0,0,0,0,0,0,0,0,0,0,0,0,0,1,0,0,0,0,0,0,0,0,0,0,0,0,0,0,0,0,0,0,0,0,0,0,0,0,0,0,0,0,0,0,0,0,0,0,0,0,0,0,0,0,0,0,0,0,0,0,0,0,0,0,0,0,0,1,0,0,0,0,0,0,0,0,campos,venho lados beja vou meio lisboa trago nada acharei nada cansaço antecipado acharei saudade sinto passado futuro deixo escrita neste livro imagem desígnio morto: ervas arrancaram
0,0,0,0,0,0,0,1,1,0,1,0,0,0,0,0,0,0,0,1,0,0,0,0,0,0,1,0,0,0,0,0,0,0,0,0,0,0,0,0,0,0,0,1,0,0,0,0,0,0,0,0,0,0,0,0,0,0,0,0,0,0,0,0,0,0,0,0,0,0,0,0,0,0,0,0,0,0,0,0,0,0,0,0,0,0,0,0,0,0,0,0,0,0,0,0,0,0,0,0,0,0,0,0,0,0,0,0,0,0,1,0,0,0,0,0,0,0,0,0,0,1,0,0,0,0,0,0,0,0,0,1,0,0,0,0,0,0,1,0,1,0,0,0,0,1,0,1,0,0,0,1,0,0,0,0,0,0,0,0,0,0,0,0,0,0,0,0,0,1,1,0,1,0,0,0,1,0,0,0,1,0,0,0,0,1,0,0,0,0,0,0,0,0,0,0,0,0,0,1,1,0,0,0,0,0,0,0,0,0,1,0,0,0,0,0,0,0,0,0,0,0,0,0,0,0,0,0,0,0,0,0,0,0,0,0,0,0,0,0,0,0,0,0,1,0,1,0,1,1,0,0,0,0,0,0,0,0,1,0,0,0,1,0,1,0,0,0,0,0,0,0,0,0,0,0,0,0,0,0,0,0,1,0,0,0,0,1,0,0,0,1,0,0,0,0,0,0,1,0,0,0,0,0,1,0,0,0,0,0,0,1,0,0,0,0,0,0,0,0,1,0,0,0,0,1,0,0,0,0,0,0,1,0,0,0,0,0,0,0,0,0,0,0,0,0,0,0,0,0,0,0,0,0,0,0,0,0,0,0,campos,esta velha angústia angústia trago séculos mim transbordou vasilha lágrimas grandes imaginações sonhos estilo pesadelo terror grandes emoções súbitas sentido nenhum transbordou mal sei conduzir-me vida mal-estar fazer-me pregas alma menos endoidecesse deveras não: estar quase poder internado manicômio menos alguém internado manicômio manicômio doido frio lúcido louco alheio tudo igual todos: dormindo desperto sonhos loucura porque sonhos assim pobre velha casa infância perdida diria desacolhesse tanto menino maluco dormia sossegado sob teto provinciano maluco quem maluco hoje menos religião qualquer exemplo manipanso casa lá nessa trazido áfrica feiíssimo grotesco nele divindade tudo crê pudesse crer manipanso qualquer -- júpiter jeová humanidade -- qualquer serviria pois tudo senão pensamos tudo
0,0,1,1,0,0,0,0,0,0,0,0,0,0,0,0,0,0,0,0,0,0,0,0,0,0,1,0,0,0,0,1,0,0,0,0,0,0,0,0,0,0,0,0,0,0,0,0,0,0,0,0,0,0,0,0,0,0,0,0,1,0,0,0,0,0,0,0,0,0,0,0,0,0,0,0,0,0,0,0,0,0,0,0,0,0,0,0,0,0,0,0,0,0,1,0,0,0,0,0,0,0,0,0,0,0,0,0,0,0,1,0,0,0,0,0,0,0,0,0,0,0,0,0,1,0,1,0,0,0,0,0,0,0,0,0,0,0,0,0,0,0,0,0,0,0,0,0,0,0,0,0,0,0,0,0,0,0,0,0,0,0,0,0,0,0,0,0,0,0,0,0,0,0,0,0,1,0,0,0,0,0,0,0,0,1,0,0,0,0,0,0,0,0,0,0,0,0,0,0,0,0,0,0,0,0,0,0,0,0,0,0,0,0,0,0,1,0,0,0,0,0,0,0,0,0,0,0,0,0,0,0,0,0,0,0,0,0,0,0,1,0,0,0,0,0,0,0,0,0,0,0,0,0,0,0,0,0,0,0,0,0,0,0,0,0,0,0,0,0,0,0,0,0,0,0,0,0,0,1,0,0,1,0,0,0,0,0,0,0,0,0,0,0,0,0,1,0,0,0,0,0,0,0,0,0,0,0,0,0,0,1,0,0,0,0,0,0,1,0,0,0,0,0,0,1,0,0,0,0,0,0,0,0,0,0,0,0,0,0,0,0,0,0,0,0,0,0,0,0,0,0,0,0,0,0,0,0,0,0,campos,estou tonto tonto tanto dormir tanto pensar ambas coisas sei tonto sei bem devo levantar cadeira levantar fiquemos nisto: tonto afinal vida fiz vida nada tudo interstícios tudo aproximações tudo função irregular absurdo tudo nada tonto agora todas manhãs levanto tonto sim verdadeiramente tonto saber mim nome saber onde saber saber nada assim assim deixo-me estar cadeira tonto bem tonto fico sentado tonto sim tonto tonto tonto
0,0,1,0,0,0,0,0,0,0,1,0,0,0,0,0,0,0,0,0,0,0,0,0,0,0,0,0,0,0,0,0,0,0,0,1,0,0,0,0,0,1,0,0,0,1,0,1,0,1,0,0,0,0,0,0,1,0,1,1,0,0,0,0,0,0,0,1,0,0,0,0,0,0,0,0,0,0,0,0,0,1,0,0,0,0,0,0,0,0,0,0,0,0,0,0,0,0,1,1,0,0,0,0,0,0,0,0,0,0,1,0,0,0,0,0,0,0,0,0,0,0,0,1,0,0,0,0,0,0,0,0,0,0,1,0,0,0,0,0,0,0,0,0,0,0,0,0,0,0,0,0,0,0,0,0,0,0,0,0,0,0,0,1,0,0,0,0,0,0,0,0,0,0,0,0,0,0,0,0,0,0,0,1,0,0,0,0,0,0,0,0,0,0,0,0,0,0,0,0,0,0,0,0,0,0,0,0,0,0,0,0,0,0,0,0,0,0,0,0,0,0,0,0,0,0,0,0,0,0,0,0,0,0,0,0,0,0,0,0,1,0,0,0,0,0,0,0,1,1,0,0,1,0,0,0,0,0,0,0,0,0,1,0,0,0,0,0,0,0,0,0,0,0,0,0,0,0,0,0,0,0,1,1,0,0,0,0,0,0,0,0,0,0,0,0,1,0,0,0,0,0,0,0,0,1,0,0,0,0,0,0,0,0,0,0,0,0,0,0,0,0,0,0,0,1,0,0,0,0,0,0,0,0,0,0,0,0,0,0,0,0,0,0,0,1,0,0,0,0,1,0,0,0,0,0,0,0,0,1,campos,estou cansado claro porque certa altura gente estar cansado cansado sei: nada serviria sabê-lo pois cansaço fica mesma ferida dói dói função causa produziu sim cansado pouco sorridente cansaço -- vontade sono corpo desejo pensar alma cima tudo transparência lúcida entendimento retrospectivo luxúria única esperanças inteligente; eis tudo visto entendido visto certo prazer cansaço dá afinal cabeça sempre serve qualquer coisa
0,0,1,0,0,0,0,0,0,0,0,0,0,0,0,0,0,0,0,0,0,0,0,1,0,0,0,0,0,0,0,0,0,0,0,0,0,0,0,0,0,0,0,0,0,0,0,0,0,0,0,1,0,0,0,0,0,0,0,0,0,0,0,0,0,0,0,0,0,0,0,0,1,0,0,0,1,0,0,0,0,0,0,0,0,0,0,0,0,0,0,0,0,0,0,0,0,0,0,0,1,0,0,0,0,0,0,0,0,0,0,0,1,1,0,0,0,0,0,0,0,0,0,0,1,0,0,0,0,0,0,0,0,1,0,0,0,0,0,0,0,0,0,0,0,0,0,0,0,0,0,0,0,0,0,0,0,0,0,0,0,0,0,0,0,0,0,0,0,0,0,0,0,0,0,0,0,0,0,0,0,0,0,0,0,0,0,0,0,0,0,0,0,1,0,0,0,0,0,0,0,0,0,0,0,0,0,0,0,0,0,0,0,0,0,0,0,0,0,0,0,0,0,0,0,0,0,1,0,0,1,0,0,0,0,0,0,0,0,0,0,0,0,0,0,1,0,0,0,1,0,0,1,0,0,1,0,0,0,0,0,0,0,0,0,0,0,0,0,0,0,0,0,0,0,0,0,0,0,0,0,0,1,0,0,0,0,0,0,0,0,0,0,0,0,0,0,0,0,0,0,0,0,0,0,0,0,0,0,0,0,0,0,0,0,0,0,0,0,0,1,0,0,0,0,1,0,0,0,0,0,0,0,0,0,0,0,0,0,0,0,0,0,0,0,0,0,0,0,0,0,0,0,0,0,0,0,0,0,0,campos,eu cheio todos cansaços quantos mundo pode dar -- afinal tudo porque tudo estrelas parece saíram algibeira deslumbrar crianças crianças sei imperfeito incógnito divino sei passado dúvida presente dúvida futuro dúvida vida pare aqui pouco eu eu fico eu
0,0,0,0,0,0,0,0,0,0,0,0,0,0,0,0,0,0,0,0,0,0,0,0,0,0,0,0,0,0,0,0,0,0,0,0,0,0,0,0,0,0,0,0,0,0,0,0,0,0,0,0,0,0,0,0,0,0,0,0,0,0,0,0,0,0,0,0,0,0,0,0,0,0,0,0,0,0,0,0,0,0,0,0,0,0,0,0,0,0,0,0,0,0,0,0,0,0,0,0,0,0,0,0,0,0,0,0,0,0,0,0,0,0,0,0,0,0,0,0,0,0,0,0,0,0,0,0,0,0,0,0,0,0,0,0,0,1,0,0,0,0,0,0,0,0,0,0,0,0,0,0,0,0,0,0,0,0,0,0,0,0,0,0,1,0,0,0,1,0,0,0,0,0,0,0,0,0,0,0,1,0,0,0,0,0,0,0,0,0,0,0,0,0,0,0,0,0,0,0,0,0,0,0,0,0,1,0,0,0,0,0,0,1,0,0,0,0,0,0,0,0,0,0,0,0,0,0,0,0,0,0,0,0,0,0,0,0,0,0,1,0,0,0,0,0,0,0,0,0,0,0,0,0,0,0,0,0,0,0,0,0,0,0,0,0,0,0,0,0,0,0,0,0,0,0,0,0,0,0,0,0,0,0,0,0,0,0,0,0,0,0,0,0,0,0,0,0,0,0,0,0,0,0,0,0,0,0,0,0,0,0,0,0,0,0,0,0,0,0,0,0,0,0,0,0,1,0,0,0,0,0,0,1,0,0,0,0,0,0,0,0,0,0,0,0,0,0,0,0,0,0,0,0,0,0,0,0,0,0,campos,faróis distantes luz subitamente tão acesa noite ausência tão rapidamente volvida noite convés conseqüências aflitas mágoa última despedidos ficção pensar faróis distantes incerteza vida voltou crescendo luz acesa avançadamente acaso olhar perdido faróis distantes vida nada serve pensar vida nada serve pensar pensar vida nada serve vamos longe luz vem grande vem menos grande faróis distantes 
0,0,0,0,0,0,0,0,0,0,0,0,0,0,0,1,0,0,0,0,0,0,0,0,0,0,0,0,0,0,0,0,0,0,0,0,0,0,0,0,0,0,0,0,0,0,0,0,0,0,0,0,0,0,0,0,0,0,0,0,0,1,0,0,0,0,0,0,0,0,0,0,0,0,0,0,0,0,0,0,0,0,0,0,0,0,0,0,0,0,0,0,0,0,0,0,1,0,0,0,0,0,0,0,0,0,0,0,0,0,0,0,0,0,0,0,0,0,0,0,0,0,0,0,0,0,0,0,0,0,0,0,0,0,0,0,0,0,1,0,1,0,1,0,0,0,0,0,0,0,0,0,0,0,0,0,0,0,0,0,0,0,0,0,0,0,0,0,0,1,0,0,0,0,0,0,0,0,0,0,0,0,0,0,0,0,0,0,1,0,0,0,1,0,0,0,0,0,0,0,0,0,0,0,0,0,0,0,0,0,0,0,0,0,0,0,0,0,0,0,0,0,0,0,0,0,0,0,0,0,0,0,0,0,0,0,0,1,0,0,0,0,0,0,0,0,0,1,0,0,0,0,1,0,0,0,0,0,0,0,0,0,1,0,0,0,0,0,0,0,0,0,0,0,0,0,0,0,0,0,0,0,0,0,0,0,0,0,0,0,0,0,0,0,0,0,0,0,0,0,0,0,0,0,0,0,0,0,0,0,0,1,0,0,0,0,0,0,0,0,0,0,0,0,1,0,0,0,0,0,0,0,0,0,0,0,0,0,0,0,0,0,0,0,0,0,0,0,0,0,0,0,0,0,0,0,0,0,0,0,campos,dos lloyd georges babilônia reza história nada briands assíria egito trotskys qualquer colônia grega romana passada nome morto inda escrito parvo dum poeta louco fazia filosofia geômetra maduro sobrevive tanto pouco lá trás escuro história historia ó grandes homens momento ó grandes glórias ferver obscuridade foge aproveitem pensamento tratem fama comer amanhã loucos hoje
0,0,0,0,0,0,0,0,0,1,0,0,0,0,0,0,0,0,0,0,0,0,0,0,0,0,0,0,0,0,0,0,0,0,0,0,0,0,0,0,0,0,0,0,0,0,0,0,0,0,0,0,0,0,0,0,1,0,0,1,0,0,0,0,0,0,0,0,0,0,0,0,0,0,0,0,0,1,0,0,0,0,0,0,0,0,0,0,0,0,0,0,0,0,0,0,0,0,1,0,0,0,0,0,0,0,0,0,0,0,1,0,0,0,0,0,0,0,0,0,0,0,0,0,0,0,0,0,0,0,0,0,0,0,0,0,0,0,0,0,0,0,0,0,0,0,1,0,0,0,0,0,0,0,0,0,0,0,0,0,0,0,0,0,0,0,0,0,0,0,0,0,0,0,0,0,1,0,0,0,0,0,1,0,0,0,0,0,1,0,0,0,0,0,0,0,0,0,0,0,0,0,0,0,0,0,0,0,0,0,0,0,0,0,0,0,0,0,0,0,1,0,0,0,0,1,0,0,0,0,0,0,0,0,0,0,0,0,0,1,0,0,0,0,0,0,0,0,0,0,0,0,0,0,0,0,0,0,0,0,0,0,0,0,0,0,0,0,0,0,0,0,0,0,0,0,0,0,0,0,0,0,0,0,0,0,0,0,0,0,1,0,0,0,0,0,0,0,0,0,0,0,0,0,0,0,0,0,0,0,0,0,0,0,0,0,0,0,0,0,0,0,0,0,0,0,0,0,0,0,0,0,0,0,0,0,0,0,0,0,0,0,0,0,0,0,0,0,0,0,0,0,0,0,0,0,0,0,0,0,campos,gostava gostar gostar momento dá-me ali cigarro maço cima mesa cabeceira continua dizias desenvolvimento metafisica kant hegel alguma coisa perdeu concordo absoluto realmente ouvir nondum amabam et amare amabam (santo agostinho) coisa curiosa associações idéias fatigado estar pensando sentir outra coisa obrigado deixa-me acender continua hegel
0,0,0,0,0,0,0,0,0,1,1,1,1,0,0,1,0,0,0,0,0,0,0,1,0,0,1,0,0,1,0,1,0,0,0,0,0,0,0,0,0,0,0,0,0,0,0,0,0,0,0,0,0,0,0,0,1,0,0,0,0,0,0,0,0,0,0,0,0,0,0,1,0,0,0,0,0,0,0,0,0,0,0,1,0,0,0,0,0,0,0,0,0,0,1,0,0,0,0,0,0,0,0,0,0,0,0,0,0,0,1,0,0,0,0,1,0,0,0,0,0,0,0,0,0,1,0,0,0,0,1,0,0,0,0,0,0,1,1,1,1,0,0,0,0,0,0,0,0,0,1,0,0,0,0,0,1,1,0,0,0,0,0,0,0,0,0,0,0,0,0,0,0,0,0,0,1,0,1,0,0,0,0,0,0,0,0,0,0,0,0,0,0,0,0,0,1,0,0,0,0,0,0,0,0,0,0,0,0,0,0,0,0,0,1,1,0,0,0,0,0,0,0,0,0,0,0,0,1,1,0,0,0,0,1,1,0,0,0,0,1,0,0,0,1,0,0,0,0,1,1,1,0,0,0,1,0,0,0,0,0,0,1,0,0,0,0,0,0,1,0,1,1,0,0,0,0,0,0,1,0,0,1,0,0,0,0,0,0,1,0,1,0,1,0,0,1,0,0,1,0,0,0,0,0,0,0,0,0,0,0,0,0,1,0,0,0,1,1,0,1,0,0,0,0,1,0,1,0,1,0,0,0,0,0,0,0,0,0,0,0,0,0,0,0,0,0,0,0,0,1,1,0,0,1,0,0,0,0,0,campos,grandes desertos tudo deserto algumas toneladas pedras tijolos alto disfarçam solo tal solo tudo grandes desertos almas desertas grandes desertas porque passa senão mesmas grandes porque ali vê tudo tudo morreu grandes desertos alma grandes desertos tirei bilhete vida errei porta sentimento vontade ocasião perdesse hoje resta vésperas viagem mala aberta esperando arrumação adiada sentado cadeira companhia camisas cabem hoje resta (à parte incômodo estar assim sentado) senão saber isto: grandes desertos tudo deserto grande vida vale pena haver vida arrumo melhor mala olhos pensar arrumar arrumação mãos factícias (e creio digo bem) acendo cigarro adiar viagem adiar todas viagens adiar universo inteiro volta amanhã realidade basta hoje gentes adia-te presente absoluto vale ser assim comprem chocolates criança sucedi erro tirem tabuleta porque amanhã infinito arrumar mala força arrumar mala mala posso levar camisas hipótese mala razão sim toda vida tido arrumar mala toda vida ficado sentado sobre canto camisas empilhadas ruminar boi chegou ápis destino arrumar mala existir arrumar malas cinza cigarro cai sobre camisa cima monte olho lado verifico dormir sei arrumar mala desertos grandes tudo deserto qualquer parábola respeito disto dessa esqueci ergo-me repente todos césares vou definitivamente arrumar mala arre arrumá-la fechá-la; vê-la levar aqui existir independentemente grandes desertos tudo deserto salvo erro naturalmente pobre alma humana oásis deserto lado vale arrumar mala fim
0,0,0,0,1,0,0,0,0,0,0,0,0,0,0,0,0,0,0,0,0,0,0,0,0,0,0,0,0,0,0,0,0,0,0,0,0,0,0,0,0,0,0,0,0,0,0,0,0,0,0,0,0,0,0,0,0,0,0,0,0,0,0,0,0,0,0,0,0,0,0,0,0,0,1,0,0,0,0,0,0,0,0,0,0,0,0,0,0,0,0,0,0,0,0,0,0,0,0,0,0,0,0,0,0,0,0,0,0,0,0,0,0,0,0,0,0,0,0,0,0,0,0,0,0,0,0,0,0,0,0,0,0,0,0,0,0,1,0,0,0,0,0,1,0,0,0,0,0,0,0,0,0,0,0,0,0,1,0,0,0,0,0,0,0,0,0,0,0,0,0,0,0,0,0,0,0,0,0,0,0,0,0,0,0,0,0,0,0,0,0,0,0,0,0,0,0,0,0,0,0,0,0,0,0,0,0,0,0,0,0,0,0,1,0,0,0,1,0,0,0,0,0,0,0,0,0,0,0,0,0,0,0,0,0,0,0,0,0,0,0,0,0,0,0,0,0,0,0,0,0,0,0,0,0,0,0,0,0,0,0,0,0,0,0,0,0,0,0,0,0,0,0,0,0,0,0,0,0,0,0,0,0,0,0,0,0,0,0,0,0,0,0,0,0,0,0,0,0,0,0,0,0,0,0,0,0,0,0,0,0,0,0,0,0,0,0,0,0,0,0,0,0,0,0,0,0,0,0,0,0,0,0,0,0,0,0,0,0,0,1,0,0,0,0,0,0,0,0,0,0,0,0,0,0,0,0,0,0,0,campos,há meia hora sentado secretária único intuito olhar (estes versos ritmo ritmo) tinteiro grande frente canetas aparos novos frente cá papel limpo lado esquerdo volume enciclopédia britânica lado direito -- ah lado direito faca papel ontem paciência abrir completamente livro interessava lerei
0,1,0,0,0,0,0,0,0,0,0,0,0,0,0,0,0,0,0,0,0,0,0,0,0,0,0,0,0,0,0,0,0,0,0,0,0,0,0,0,0,0,0,0,0,0,0,0,0,0,0,0,0,0,0,0,0,0,0,0,0,0,0,0,0,0,0,0,0,0,0,0,0,0,0,0,0,0,0,0,0,0,0,0,1,0,0,0,0,0,0,0,0,0,1,0,0,0,0,0,0,0,0,0,0,0,1,0,0,0,0,0,0,0,0,0,0,0,0,0,0,0,0,0,0,0,0,0,0,0,0,0,0,0,0,0,0,0,0,0,0,0,0,0,0,0,0,0,0,0,0,0,0,1,0,0,0,0,0,0,0,0,0,0,0,0,0,0,0,0,0,0,0,0,0,0,1,0,0,0,0,0,0,0,0,0,0,0,0,0,0,1,0,1,0,0,0,0,0,0,0,0,0,0,0,0,1,0,0,0,0,0,0,0,0,0,0,0,0,0,0,0,0,0,0,0,0,0,0,0,0,0,0,0,0,0,0,0,0,0,1,0,0,0,0,0,0,0,0,0,0,1,0,0,0,0,0,0,0,0,0,0,0,0,0,0,0,0,0,0,0,0,0,0,0,0,0,0,0,0,0,0,0,0,0,0,0,0,0,0,0,0,0,0,0,0,0,0,0,0,0,0,0,0,0,0,0,0,0,0,0,0,0,0,0,0,0,0,0,0,0,0,0,0,0,0,0,0,0,0,0,0,0,0,0,0,0,0,0,0,0,0,0,0,0,0,0,0,0,0,0,0,0,0,0,0,0,0,0,0,campos,insônia durmo espero dormir morte espero dormir espera-me insônia largura astros bocejo inútil comprimento mundo durmo; posso ler acordo noite posso escrever acordo noite posso pensar acordo noite -- deus posso sonhar acordo noite
0,0,0,0,0,0,1,0,0,0,1,0,0,0,0,0,0,0,0,0,0,0,0,0,0,0,0,0,0,0,0,0,0,0,0,1,0,0,0,0,0,1,0,0,0,0,0,0,0,0,1,0,0,0,0,0,1,0,0,1,1,0,0,1,0,0,0,0,1,0,0,0,0,0,0,0,0,0,0,1,0,0,0,0,0,0,0,1,0,0,0,1,0,0,1,0,0,0,0,0,0,0,0,1,0,0,0,0,0,0,1,0,0,0,0,0,0,0,0,0,0,0,0,0,0,0,0,0,0,0,1,0,0,0,0,0,0,1,0,0,0,0,0,0,1,1,0,1,0,0,0,0,0,0,0,0,0,1,0,0,0,0,0,0,0,0,0,0,0,1,0,0,0,0,0,0,1,0,0,0,0,0,0,0,0,1,0,0,0,0,0,0,0,0,0,1,0,0,1,0,0,0,0,0,0,0,1,0,0,0,1,0,0,0,0,1,0,0,0,0,1,0,1,0,0,0,0,0,0,0,0,0,0,0,0,0,0,1,0,0,0,0,0,1,0,0,1,0,0,1,0,0,0,0,0,0,0,0,1,0,0,0,1,0,0,0,0,0,0,0,0,0,0,0,0,0,0,0,0,0,0,1,1,1,1,1,0,0,0,1,1,0,0,0,0,1,1,1,0,0,0,0,0,0,0,1,0,1,0,0,0,1,0,0,0,0,0,1,1,0,1,0,1,0,0,1,0,1,0,0,0,0,1,1,0,0,0,1,0,0,1,0,0,0,0,0,0,0,0,0,0,0,0,0,0,0,0,0,1,0,campos,não durmo jazo cadáver acordado sentindo sentimento pensamento vazio passam mim transtornadas coisas sucederam -- todas arrependo culpo; passam mim transtornadas coisas sucederam -- todas arrependo culpo; passam mim transtornadas coisas nada dessas arrependo culpo durmo força energia acender cigarro fito parede fronteira quarto universo lá silêncio dessa coisa toda grande silêncio apavorante noutra ocasião qualquer noutra ocasião qualquer pudesse sentir escrevendo versos realmente simpáticos -- versos dizer nada dizer versos teimar dizer versos versos versos versos versos tantos versos verdade toda vida toda mim sono durmo sinto sei sentir sensação pessoa correspondente abstração autoconsciência quê salvo necessário sentir consciência salvo -- sei lá salvo quê durmo durmo durmo grande sono toda cabeça cima olhos alma grande sono tudo exceto poder dormir ó madrugada tardas tanto vem vem inutilmente trazer-me outro dia igual seguido outra noite igual vem trazer-me alegria dessa esperança triste porque sempre és alegre sempre trazes esperança segundo velha literatura sensações vem traz esperança vem traz esperança cansaço entra colchão dentro doem-me costas estar deitado lado deitado lado doíam-me costas estar deitado lado vem madrugada chega horas sei energia estender mão relógio energia nada nada versos escritos dia seguinte sim escritos dia seguinte todos versos sempre escritos dia seguinte noite absoluta sossego absoluto lá paz toda natureza humanidade repousa esquece amarguras exatamente humanidade esquece alegrias amarguras costuma dizer-se humanidade esquece sim humanidade esquece acordada humanidade esquece exatamente durmo
0,0,0,0,0,1,0,0,0,0,1,0,0,0,0,0,0,0,0,0,1,0,0,1,0,0,0,0,0,0,0,0,0,0,0,0,0,0,0,0,0,0,0,0,0,0,0,0,0,0,0,0,0,0,0,0,0,0,0,0,0,0,0,0,0,0,0,0,0,0,0,0,0,0,0,0,0,0,1,0,0,0,0,0,1,0,0,1,0,0,0,0,0,0,0,0,0,0,0,0,0,0,0,0,1,0,0,0,0,0,1,0,0,0,0,0,0,0,0,0,0,0,0,0,0,0,0,0,0,0,0,0,0,1,1,0,0,0,0,0,1,1,0,0,0,0,0,0,0,1,0,0,0,1,0,0,0,1,0,0,0,0,0,0,0,0,0,1,1,0,0,0,0,0,0,0,1,0,1,0,1,0,0,1,0,1,0,0,1,0,1,0,0,0,0,1,0,0,0,0,0,0,0,1,0,0,0,0,0,1,0,0,0,0,0,0,0,0,0,0,1,0,1,0,0,0,0,0,0,0,0,0,0,0,0,1,0,0,0,0,1,0,0,1,0,0,0,0,0,1,0,0,0,0,0,0,0,0,0,1,0,1,0,0,0,0,0,0,1,1,0,0,0,0,0,0,0,0,1,0,0,1,0,1,0,0,0,0,0,0,1,0,0,0,0,0,0,0,0,0,0,0,0,0,0,0,0,0,0,0,0,0,0,0,0,0,0,1,0,1,0,0,0,0,0,0,0,1,0,0,1,1,1,0,0,0,1,0,0,0,0,0,0,0,0,0,0,0,0,0,0,1,0,0,1,0,0,0,0,0,campos,véspera viagem campainha sobreavisem estridentemente quero gozar repouso gare alma antes ver avançar mim chegada ferro comboio definitivo antes sentir partida verdadeira goelas estômago antes pôr estribo pé nunca aprendeu emoção sempre partir quero neste momento fumando apeadeiro hoje estar ainda bocado agarrado velha vida vida inútil melhor deixar cela importa todo universo cela estar preso ver tamanho cela sabe-me náusea próxima cigarro comboio partiu outra estação adeus adeus adeus toda gente veio despedir-se mim família abstrata impossível adeus dia hoje adeus apeadeiro hoje adeus vida adeus vida ficar volume rotulado esquecido canto resguardo passageiros outro lado linha encontrado guarda casual partida -- então tipo deixou aqui -- ficar pensar partir ficar razão ficar morrer menos vou futuro exame difícil comboio nunca chegasse deus pena mim vejo estação aqui simples metáfora pessoa perfeitamente apresentável vê-se -- dizem -- vivido estrangeiro modos homem educado evidentemente pego mala rejeitando moço vicio vil mão pego mala treme-me partir nunca voltarei nunca voltarei porque nunca volta lugar volta sempre outro gare volta outra mesma gente mesma luz mesma filosofia partir deus partir medo partir
0,0,0,0,0,0,0,0,0,0,0,0,0,0,0,0,0,0,0,0,0,0,0,1,0,0,0,0,0,0,0,0,0,0,0,0,0,0,0,0,0,0,0,0,1,0,0,0,0,0,0,0,0,0,0,0,0,0,0,1,0,0,0,0,1,0,0,0,0,0,0,0,0,0,0,0,0,0,0,1,0,0,0,0,0,0,0,0,0,1,0,0,0,0,1,0,0,0,0,0,0,0,0,0,0,0,0,0,0,1,0,0,0,0,0,0,0,0,0,0,0,0,0,1,1,0,0,0,0,0,1,0,0,0,0,0,0,0,1,0,0,0,0,0,0,0,0,0,0,0,0,0,0,1,0,0,0,1,0,0,0,1,0,0,0,0,0,0,0,0,0,0,0,0,0,0,0,0,0,0,0,0,0,0,0,1,0,0,0,0,0,0,0,0,0,0,0,0,0,0,0,0,0,0,0,0,1,0,0,0,0,0,0,0,0,0,0,0,0,0,1,0,0,0,0,0,0,0,0,0,0,0,0,0,0,0,0,0,0,0,1,0,0,0,0,0,1,0,0,1,0,0,0,0,0,0,0,0,0,0,0,0,1,0,0,0,0,0,1,0,0,0,0,0,0,0,0,0,0,0,0,0,0,1,0,0,0,0,0,0,1,0,0,0,0,0,0,0,0,0,0,0,0,1,0,1,0,0,0,0,0,0,0,0,0,0,0,0,0,0,0,0,0,0,0,0,0,0,0,0,0,1,0,0,0,0,0,0,0,0,0,0,0,0,1,0,0,0,0,0,0,0,0,0,0,0,0,0,0,0,campos,lisboa casas várias cores lisboa casas várias cores lisboa casas várias cores força diferente monótono força sentir fico pensar noite deitado desperto lucidez inútil poder dormir quero imaginar qualquer coisa surge sempre outra (porque sono porque sono bocado sonho) quero alongar vista imagino grandes palmares fantásticos vejo contra espécie lado dentro pálpebras lisboa casas várias cores sorrio porque aqui deitado outra coisa força monótono diferente força durmo esqueço existo fica mim esqueci porque durmo lisboa casas várias cores
0,0,0,0,1,0,0,0,0,0,0,0,0,0,0,0,0,1,0,0,0,0,0,0,0,0,1,0,1,0,0,0,0,0,0,0,0,0,0,0,0,0,0,0,0,0,0,0,0,0,0,0,0,0,0,0,0,0,0,1,0,0,0,0,0,0,0,0,0,0,0,0,0,0,0,1,0,0,0,1,0,0,0,0,1,1,0,0,0,0,0,0,0,0,0,0,0,0,0,0,0,0,1,0,0,0,0,0,0,0,1,0,0,0,0,0,0,0,0,0,0,0,0,0,0,0,1,0,0,0,0,0,0,0,0,0,0,0,0,0,1,0,0,0,0,0,0,0,0,0,0,1,0,0,1,0,0,0,0,0,0,1,0,1,0,0,0,0,0,0,0,0,1,0,0,0,1,0,0,0,0,0,0,0,0,1,0,0,0,0,1,0,0,0,0,0,0,0,0,0,0,0,0,0,0,0,0,0,0,1,1,0,0,0,0,0,1,0,0,0,1,0,0,1,0,0,0,0,0,0,0,0,0,0,0,0,0,0,0,0,0,0,0,1,0,0,0,0,0,0,0,0,0,0,0,0,0,0,0,0,0,0,1,0,0,0,0,0,1,0,0,0,0,0,0,0,0,0,0,0,0,0,0,0,0,0,0,0,0,0,0,0,0,0,0,1,0,0,0,0,0,0,0,0,0,0,0,0,0,1,0,0,0,0,0,0,0,0,0,1,1,0,0,0,0,0,0,0,0,0,0,0,0,0,0,0,0,1,0,0,0,0,0,0,0,0,0,0,0,0,1,0,0,1,0,0,0,0,0,1,campos,(l923) não: quero nada disse quero nada venham conclusões única conclusão morrer tragam estéticas falem moral tirem-me daqui metafísica apregoem sistemas completos enfileirem conquistas ciências (das ciências deus ciências) -- ciências artes civilização moderna mal fiz deuses todos verdade guardem-na técnico técnica dentro técnica disso doido todo direito sê-lo todo direito sê-lo ouviram macem amor deus queriam-me casado fútil quotidiano tributável queriam-me contrário disto contrário qualquer coisa outra pessoa fazia-lhes todos vontade assim paciência vão diabo mim deixem-me ir sozinho diabo ir juntos peguem braço gosto peguem braço quero sozinho disse sozinho ah maçada quererem companhia ó céu azul -- infância -- eterna verdade vazia perfeita ó macio tejo ancestral mudo pequena verdade onde céu reflete ó mágoa revisitada lisboa outrora hoje nada dais nada tirais nada sois sinta deixem-me paz tardo nunca tardo enquanto tarda abismo silêncio quero estar sozinho
0,0,0,0,0,0,0,1,0,0,1,0,0,0,0,0,0,0,0,1,0,0,0,1,0,0,0,1,0,0,0,0,0,0,0,0,1,0,0,0,1,1,0,0,0,1,0,0,0,0,0,0,0,0,1,0,0,0,0,1,1,0,0,0,0,0,1,0,0,0,0,0,0,0,0,0,0,1,0,0,0,0,0,1,1,0,0,0,0,0,0,0,0,0,0,0,0,0,0,0,0,0,0,1,0,0,0,1,0,0,0,0,0,0,0,1,0,0,0,0,0,0,0,0,0,0,0,0,0,0,0,0,1,1,0,0,0,0,0,0,0,0,0,0,0,0,0,0,0,0,0,1,0,1,0,0,0,0,0,0,0,1,0,0,0,0,0,0,1,0,1,0,0,0,0,0,1,0,0,1,1,0,0,1,0,1,0,0,1,0,0,0,0,0,0,0,0,1,0,0,0,1,0,0,0,0,1,0,1,0,1,0,0,0,0,0,1,0,0,0,1,0,0,0,0,1,0,0,1,1,1,0,0,0,0,0,0,0,0,0,0,0,0,0,0,0,0,0,0,0,1,0,0,0,0,0,0,0,0,0,0,0,0,0,0,0,0,0,1,0,0,0,0,0,0,0,1,1,0,0,0,1,1,0,0,0,0,0,0,0,0,0,0,0,0,0,0,0,0,0,0,0,1,1,1,0,0,0,0,0,0,0,0,0,1,0,1,1,1,0,1,0,1,0,0,1,0,0,0,0,0,1,0,0,0,0,1,0,0,0,0,1,0,0,0,0,0,0,1,1,0,0,0,0,0,1,0,0,0,0,campos,nada prende nada quero cinqüenta coisas tempo anseio angústia fome carne sei - definidamente indefinido durmo irrequieto vivo sonhar irrequieto dorme irrequieto metade sonhar fecharam-me todas portas abstratas necessárias correram cortinas todas hipóteses poderia ver rua travessa achada número porta deram acordei mesma vida adormecido exércitos sonhados sofreram derrota sonhos sentiram falsos serem sonhados vida desejada farta - vida compreendo intervalos desconexos; escrevo lapsos cansaço; tédio tédio arroja-me praia sei destino futuro compete angústia leme; sei ilhas sul impossível aguardam-me naufrago; palmares literatura darão menos verso não sei outra coisa coisa nenhuma fundo espírito onde sonho sonhei campos últimos alma onde memoro causa (e passado névoa natural lágrimas falsas) estradas atalhos florestas longínquas onde supus fogem desmantelados últimos restos ilusão final exércitos sonhados derrotados sido cortes existir esfaceladas deus outra vez revejo cidade infância pavorosamente perdida cidade triste alegre outra vez sonho aqui aqui vivi aqui voltei aqui tornei voltar voltar aqui novo tornei voltar todos aqui série contas-entes ligados fio-memória série sonhos mim alguém mim outra vez revejo coração longínquo alma menos outra vez revejo - lisboa tejo tudo - transeunte inútil ti mim estrangeiro aqui toda parte casual vida alma fantasma errar salas recordações ruído ratos tábuas rangem castelo maldito viver outra vez revejo sombra passa através sombras brilha momento luz fúnebre desconhecida entra noite rastro barco perde água deixa ouvir outra vez revejo ai mim revejo partiu-se espelho mágico revia idêntico cada fragmento fatídico vejo bocado mim - bocado ti mim
0,0,0,0,0,0,0,0,1,0,1,0,1,0,0,0,0,0,0,0,0,0,0,0,0,0,0,0,0,0,0,0,0,0,0,0,0,0,0,0,0,0,0,1,0,0,0,0,0,0,0,0,0,0,0,0,0,0,0,0,0,0,0,0,0,0,1,0,0,0,0,0,0,0,0,0,0,0,0,0,0,0,0,0,0,0,0,1,0,0,0,0,0,0,0,0,0,0,0,0,0,0,0,0,1,0,0,0,0,0,1,0,1,0,0,0,0,0,0,0,0,0,0,0,0,0,0,0,0,0,0,1,1,0,0,0,0,0,0,0,0,0,0,0,0,0,0,0,0,0,0,0,0,0,0,0,0,0,0,0,0,0,0,0,0,0,0,0,0,1,0,0,0,0,0,0,0,0,0,0,0,0,0,0,0,0,0,0,0,0,0,0,0,0,0,0,0,0,0,0,0,0,0,0,0,0,1,0,0,0,0,0,0,0,0,1,1,0,0,0,0,0,0,0,0,0,0,0,0,0,0,0,0,0,0,0,0,0,0,0,0,0,0,0,0,0,0,0,0,0,0,0,0,0,0,0,0,0,0,0,0,0,0,0,0,0,0,0,0,0,0,0,0,0,0,0,0,0,0,0,0,0,1,0,0,0,0,0,0,0,0,0,0,0,0,0,0,0,0,0,1,0,0,0,0,0,0,0,0,0,0,0,0,0,0,0,0,0,0,0,0,0,0,0,0,0,0,1,0,0,0,0,0,0,0,0,0,0,0,0,0,0,0,0,0,0,0,0,0,0,0,0,0,0,0,0,0,0,0,0,campos,quando passará noite interna universo alma dia despertarei estar acordado sei sol brilha alto impossível fitar estrelas pestanejam frio impossíveis contar coração pulsa alheio impossível escutar passará drama teatro teatro drama recolherei casa onde gato fitas olhos vida tens lá fundo esse mandará josué parar sol acordarei; então dia sorri dormindo alma sorri alma dia
